{
  "format": "MGO2MT.UI_LAYOUT.1",
  "width": 1280,
  "height": 720,
  "elements": [
    {
      "id": "backdrop",
      "screen": "title",
      "state": "*",
      "flagsAll": [],
      "flagsNone": [],
      "kind": "panel",
      "x": 60,
      "y": 130,
      "width": 1160,
      "height": 480,
      "anchor": "top-left",
      "z": 0,
      "visible": true,
      "color": [
        20,
        40,
        50,
        255
      ],
      "texture": "",
      "text": "",
      "fontSize": 28,
      "font": "Yu Gothic",
      "bind": "",
      "onClick": [],
      "onChange": [],
      "delayMs": 0,
      "shadowX": 0,
      "shadowY": 0,
      "options": [],
      "selected": ""
    },
    {
      "id": "heading",
      "screen": "title",
      "state": "*",
      "flagsAll": [],
      "flagsNone": [],
      "kind": "text",
      "x": 110,
      "y": 170,
      "width": 1020,
      "height": 50,
      "anchor": "top-left",
      "z": 1,
      "visible": true,
      "color": [
        112,
        220,
        205,
        255
      ],
      "texture": "",
      "text": "BUTTON  /  SOUND  /  EVENT",
      "fontSize": 36,
      "font": "Yu Gothic",
      "bind": "",
      "onClick": [],
      "onChange": [],
      "delayMs": 0,
      "shadowX": 0,
      "shadowY": 0,
      "options": [],
      "selected": ""
    },
    {
      "id": "sound_button",
      "screen": "title",
      "state": "*",
      "flagsAll": [],
      "flagsNone": [],
      "kind": "button",
      "x": 110,
      "y": 260,
      "width": 570,
      "height": 78,
      "anchor": "top-left",
      "z": 2,
      "visible": true,
      "color": [
        39,
        91,
        106,
        255
      ],
      "texture": "",
      "text": "音を鳴らしてから開始",
      "fontSize": 32,
      "font": "Yu Gothic",
      "bind": "",
      "onClick": [
        {
          "type": "playSound",
          "sound": "audio/confirmation.wav",
          "waitForEnd": true
        },
        {
          "type": "delay",
          "ms": 120
        },
        {
          "type": "setVariable",
          "name": "message",
          "value": "再生終了を確認 → イベント開始"
        },
        {
          "type": "setVisible",
          "target": "after",
          "visible": true
        },
        {
          "type": "emitEvent",
          "name": "title.start"
        }
      ],
      "onChange": [],
      "delayMs": 250,
      "hoverColor": [
        49,
        124,
        140,
        255
      ],
      "pressedColor": [
        37,
        170,
        148,
        255
      ],
      "textColor": [
        242,
        250,
        250,
        255
      ],
      "shadowColor": [
        0,
        0,
        0,
        140
      ],
      "shadowX": 5,
      "shadowY": 6,
      "options": [],
      "selected": ""
    },
    {
      "id": "weather",
      "screen": "title",
      "state": "*",
      "flagsAll": [],
      "flagsNone": [],
      "kind": "dropdown",
      "x": 730,
      "y": 260,
      "width": 400,
      "height": 78,
      "anchor": "top-left",
      "z": 3,
      "visible": true,
      "color": [
        43,
        63,
        82,
        255
      ],
      "texture": "",
      "text": "",
      "fontSize": 30,
      "font": "Yu Gothic",
      "bind": "weather_choice",
      "onClick": [],
      "onChange": [
        {
          "type": "playSound",
          "sound": "audio/confirmation.mp3",
          "waitForEnd": true
        },
        {
          "type": "emitEvent",
          "name": "weather_changed"
        }
      ],
      "delayMs": 150,
      "hoverColor": [
        62,
        88,
        109,
        255
      ],
      "pressedColor": [
        45,
        128,
        145,
        255
      ],
      "textColor": [
        240,
        245,
        255,
        255
      ],
      "shadowColor": [
        0,
        0,
        0,
        120
      ],
      "shadowX": 5,
      "shadowY": 6,
      "options": [
        {
          "value": "clear",
          "label": "晴れ"
        },
        {
          "value": "rain",
          "label": "雨"
        },
        {
          "value": "snow",
          "label": "雪"
        }
      ],
      "selected": "clear"
    },
    {
      "id": "after",
      "screen": "title",
      "state": "*",
      "flagsAll": [],
      "flagsNone": [],
      "kind": "text",
      "x": 110,
      "y": 395,
      "width": 1020,
      "height": 65,
      "anchor": "top-left",
      "z": 1,
      "visible": false,
      "color": [
        130,
        240,
        204,
        255
      ],
      "texture": "",
      "text": "待機中",
      "fontSize": 32,
      "font": "Yu Gothic",
      "bind": "message",
      "onClick": [],
      "onChange": [],
      "delayMs": 0,
      "shadowX": 0,
      "shadowY": 0,
      "options": [],
      "selected": ""
    },
    {
      "id": "hint",
      "screen": "title",
      "state": "*",
      "flagsAll": [],
      "flagsNone": [],
      "kind": "text",
      "x": 110,
      "y": 490,
      "width": 1020,
      "height": 85,
      "anchor": "top-left",
      "z": 1,
      "visible": true,
      "color": [
        173,
        195,
        207,
        255
      ],
      "texture": "",
      "text": "Delay 250 ms → WAV終了 → 120 ms → title.start\nプルダウン変更 → MP3終了 → 選択値をイベントへ",
      "fontSize": 24,
      "font": "Yu Gothic",
      "bind": "",
      "onClick": [],
      "onChange": [],
      "delayMs": 0,
      "shadowX": 0,
      "shadowY": 0,
      "options": [],
      "selected": ""
    }
  ]
}
